{
  "id": "cop:wake:continuation:example-judgment:by-ref",
  "packet_type": "cop/node.wake.v1",
  "artifact_type": "cop/cognitive-packet",
  "payload": {
    "schema": "cop/node.wake.v1",
    "due_at": null,
    "cadence": { "kind": "once" },
    "deadline": null,
    "stop_condition": { "type": "none" },
    "escalation_policy": null,
    "authorized": false,
    "packet_ref": "continuation:example-judgment"
  }
}
